No.,Time,Source,Destination,Protocol,Length,Info,,,,,,,,,,,,,,,,,,,,,,,,,,,time 2,time 1,delay 1,delay 2,jiter
1,0,fe80::ffff:ffff:fffe,ff02::2,ICMPv6,103,Router Solicitation,,,,,,,,,,,,,,,,,,,,,,,,,,,2.000151,0,2.000151,4.000389,2.000238
2,2.000151,fe80::ffff:ffff:fffe,ff02::2,ICMPv6,103,Router Solicitation,,,,,,,,,,,,,,,,,,,,,,,,,,,6.00054,2.000151,4.000389,0.452434,3.547955
3,6.00054,fe80::ffff:ffff:fffe,ff02::2,ICMPv6,103,Router Solicitation,,,,,,,,,,,,,,,,,,,,,,,,,,,6.452974,6.00054,0.452434,0.01627,0.436164
4,6.452974,192.168.100.10,74.125.130.136,TCP,54,"50248  >  443 [FIN, ACK] Seq=1 Ack=1 Win=254 Len=0",,,,,,,,,,,,,,,,,,,,,,,,,,,6.469244,6.452974,0.01627,0.000148,0.016122
5,6.469244,74.125.130.136,192.168.100.10,TCP,54,"443  >  50248 [FIN, ACK] Seq=1 Ack=2 Win=283 Len=0",,,,,,,,,,,,,,,,,,,,,,,,,,,6.469392,6.469244,0.000148,7.540892,7.540744
6,6.469392,192.168.100.10,74.125.130.136,TCP,54,50248  >  443 [ACK] Seq=2 Ack=2 Win=254 Len=0,,,,,,,,,,,,,,,,,,,,,,,,,,,14.010284,6.469392,7.540892,1.974585,5.566307
7,14.010284,fe80::ffff:ffff:fffe,ff02::2,ICMPv6,103,Router Solicitation,,,,,,,,,,,,,,,,,,,,,,,,,,,15.984869,14.010284,1.974585,0.024886,1.949699
8,15.984869,192.168.100.10,74.125.200.188,TLSv1.2,80,Application Data,,,,,,,,,,,,,,,,,,,,,,,,,,,16.009755,15.984869,0.024886,0.012385,0.012501
9,16.009755,74.125.200.188,192.168.100.10,TCP,54,5228  >  49169 [ACK] Seq=1 Ack=27 Win=265 Len=0,,,,,,,,,,,,,,,,,,,,,,,,,,,16.02214,16.009755,0.012385,0.199649,0.187264
10,16.02214,74.125.200.188,192.168.100.10,TLSv1.2,80,Application Data,,,,,,,,,,,,,,,,,,,,,,,,,,,16.221789,16.02214,0.199649,2.382061,2.182412
11,16.221789,192.168.100.10,74.125.200.188,TCP,54,49169  >  5228 [ACK] Seq=27 Ack=27 Win=254 Len=0,,,,,,,,,,,,,,,,,,,,,,,,,,,18.60385,16.221789,2.382061,0.00303,2.379031
12,18.60385,LiteonTe_f9:2f:0b,HuaweiTe_c7:50:48,ARP,42,Who has 192.168.100.1? Tell 192.168.100.10,,,,,,,,,,,,,,,,,,,,,,,,,,,18.60688,18.60385,0.00303,1.266073,1.263043
13,18.60688,HuaweiTe_c7:50:48,LiteonTe_f9:2f:0b,ARP,42,192.168.100.1 is at 20:65:8e:c7:50:48,,,,,,,,,,,,,,,,,,,,,,,,,,,19.872953,18.60688,1.266073,3.050576,1.784503
14,19.872953,fe80::2265:8eff:fec7:5050,ff02::2,ICMPv6,70,Router Solicitation from 20:65:8e:c7:50:50,,,,,,,,,,,,,,,,,,,,,,,,,,,22.923529,19.872953,3.050576,0.021783,3.028793
15,22.923529,192.168.100.10,69.171.250.60,TLSv1.2,85,Application Data,,,,,,,,,,,,,,,,,,,,,,,,,,,22.945312,22.923529,0.021783,0.266398,0.244615
16,22.945312,69.171.250.60,192.168.100.10,TCP,54,443  >  50231 [ACK] Seq=1 Ack=32 Win=246 Len=0,,,,,,,,,,,,,,,,,,,,,,,,,,,23.21171,22.945312,0.266398,0.150089,0.116309
17,23.21171,69.171.250.60,192.168.100.10,TLSv1.2,92,Application Data,,,,,,,,,,,,,,,,,,,,,,,,,,,23.361799,23.21171,0.150089,9.90E-05,0.14999
18,23.361799,69.171.250.60,192.168.100.10,TCP,92,"[TCP Retransmission] 443  >  50231 [PSH, ACK] Seq=1 Ack=32 Win=246 Len=38",,,,,,,,,,,,,,,,,,,,,,,,,,,23.361898,23.361799,9.90E-05,0.454057,0.453958
19,23.361898,192.168.100.10,69.171.250.60,TCP,66,50231  >  443 [ACK] Seq=32 Ack=39 Win=932 Len=0 SLE=1 SRE=39,,,,,,,,,,,,,,,,,,,,,,,,,,,23.815955,23.361898,0.454057,,
20,23.815955,192.168.100.10,192.168.100.1,DNS,75,Standard query 0xf600 A www.youtube.com,,,,,,,,,,,,,,,,,,,,,,,,,,,,tot delay,23.815955,tot jiter,32.859648
21,23.842171,192.168.100.1,192.168.100.10,DNS,237,Standard query response 0xf600 A www.youtube.com CNAME youtube-ui.l.google.com A 74.125.68.190 A 172.217.194.91 A 172.217.194.190 A 172.217.194.93 A 172.217.194.136 A 74.125.24.136 A 74.125.24.91 A 74.125.24.190,,,,,,,,,,,,,,,,,,,,,,,,,,,,rat delay,0.002449697,rat jiter,0.003379927
22,23.8467,192.168.100.10,74.125.68.190,TCP,66,50249  >  443 [SYN] Seq=0 Win=8192 Len=0 MSS=1460 WS=256 SACK_PERM=1,,,,,,,,,,,,,,,,,,,,,,,,,,,,,,,
23,23.863795,74.125.68.190,192.168.100.10,TCP,66,"443  >  50249 [SYN, ACK] Seq=0 Ack=1 Win=65535 Len=0 MSS=1412 SACK_PERM=1 WS=256",,,,,,,,,,,,,,,,,,,,,,,,,,,,,,,
24,23.863979,192.168.100.10,74.125.68.190,TCP,54,50249  >  443 [ACK] Seq=1 Ack=1 Win=66304 Len=0,,,,,,,,,,,,,,,,,,,,,,,,,,,,,,,
25,23.866398,192.168.100.10,74.125.68.190,TLSv1.3,635,Client Hello,,,,,,,,,,,,,,,,,,,,,,,,,,,,,,,
26,23.885998,74.125.68.190,192.168.100.10,TCP,54,443  >  50249 [ACK] Seq=1 Ack=582 Win=66816 Len=0,,,,,,,,,,,,,,,,,,,,,,,,,,,,,,,
27,23.901816,74.125.68.190,192.168.100.10,TLSv1.3,266,"Server Hello, Change Cipher Spec, Application Data",,,,,,,,,,,,,,,,,,,,,,,,,,,,,,,
28,23.909987,192.168.100.10,74.125.68.190,TLSv1.3,118,"Change Cipher Spec, Application Data",,,,,,,,,,,,,,,,,,,,,,,,,,,,,,,
29,23.911022,192.168.100.10,74.125.68.190,TLSv1.3,146,Application Data,,,,,,,,,,,,,,,,,,,,,,,,,,,,,,,
30,23.912893,192.168.100.10,74.125.68.190,TCP,1466,50249  >  443 [ACK] Seq=738 Ack=213 Win=66048 Len=1412 [TCP segment of a reassembled PDU],,,,,,,,,,,,,,,,,,,,,,,,,,,,,,,
31,23.912923,192.168.100.10,74.125.68.190,TLSv1.3,382,Application Data,,,,,,,,,,,,,,,,,,,,,,,,,,,,,,,
32,23.930166,74.125.68.190,192.168.100.10,TCP,56,[TCP Previous segment not captured] 443  >  50249 [ACK] Seq=824 Ack=2478 Win=72448 Len=0,,,,,,,,,,,,,,,,,,,,,,,,,,,,,,,
33,23.935946,74.125.68.190,192.168.100.10,TCP,634,"[TCP Out-Of-Order] 443  >  50249 [PSH, ACK] Seq=213 Ack=646 Win=66816 Len=580",,,,,,,,,,,,,,,,,,,,,,,,,,,,,,,
34,23.93595,74.125.68.190,192.168.100.10,TCP,85,"[TCP Retransmission] 443  >  50249 [PSH, ACK] Seq=793 Ack=738 Win=66816 Len=31",,,,,,,,,,,,,,,,,,,,,,,,,,,,,,,
35,23.935951,74.125.68.190,192.168.100.10,TLSv1.3,454,Application Data,,,,,,,,,,,,,,,,,,,,,,,,,,,,,,,
36,23.936098,192.168.100.10,74.125.68.190,TCP,54,50249  >  443 [ACK] Seq=2478 Ack=1224 Win=65024 Len=0,,,,,,,,,,,,,,,,,,,,,,,,,,,,,,,
37,23.937673,192.168.100.10,74.125.68.190,TLSv1.3,85,Application Data,,,,,,,,,,,,,,,,,,,,,,,,,,,,,,,
38,23.9522,74.125.68.190,192.168.100.10,TLSv1.3,85,Application Data,,,,,,,,,,,,,,,,,,,,,,,,,,,,,,,
39,23.952204,74.125.68.190,192.168.100.10,TLSv1.3,93,Application Data,,,,,,,,,,,,,,,,,,,,,,,,,,,,,,,
40,23.952353,192.168.100.10,74.125.68.190,TCP,54,50249  >  443 [ACK] Seq=2509 Ack=1294 Win=65024 Len=0,,,,,,,,,,,,,,,,,,,,,,,,,,,,,,,
41,23.958083,192.168.100.10,74.125.68.190,TLSv1.3,93,Application Data,,,,,,,,,,,,,,,,,,,,,,,,,,,,,,,
42,23.959111,74.125.68.190,192.168.100.10,TCP,56,443  >  50249 [ACK] Seq=1294 Ack=2509 Win=72448 Len=0,,,,,,,,,,,,,,,,,,,,,,,,,,,,,,,
43,23.97454,74.125.68.190,192.168.100.10,TCP,56,443  >  50249 [ACK] Seq=1294 Ack=2548 Win=72448 Len=0,,,,,,,,,,,,,,,,,,,,,,,,,,,,,,,
44,24.338489,192.168.100.10,192.168.100.1,DNS,71,Standard query 0x7c6e A i.ytimg.com,,,,,,,,,,,,,,,,,,,,,,,,,,,,,,,
45,24.362202,192.168.100.1,192.168.100.10,DNS,87,Standard query response 0x7c6e A i.ytimg.com A 172.217.194.119,,,,,,,,,,,,,,,,,,,,,,,,,,,,,,,
46,24.377146,192.168.100.10,172.217.194.119,TCP,66,50250  >  443 [SYN] Seq=0 Win=8192 Len=0 MSS=1460 WS=256 SACK_PERM=1,,,,,,,,,,,,,,,,,,,,,,,,,,,,,,,
47,24.402205,172.217.194.119,192.168.100.10,TCP,66,"443  >  50250 [SYN, ACK] Seq=0 Ack=1 Win=65535 Len=0 MSS=1412 SACK_PERM=1 WS=256",,,,,,,,,,,,,,,,,,,,,,,,,,,,,,,
48,24.402386,192.168.100.10,172.217.194.119,TCP,54,50250  >  443 [ACK] Seq=1 Ack=1 Win=66304 Len=0,,,,,,,,,,,,,,,,,,,,,,,,,,,,,,,
49,24.410585,192.168.100.10,172.217.194.119,TLSv1.3,631,Client Hello,,,,,,,,,,,,,,,,,,,,,,,,,,,,,,,
50,24.436193,172.217.194.119,192.168.100.10,TCP,54,443  >  50250 [ACK] Seq=1 Ack=578 Win=66816 Len=0,,,,,,,,,,,,,,,,,,,,,,,,,,,,,,,
51,24.4522,172.217.194.119,192.168.100.10,TLSv1.3,266,"Server Hello, Change Cipher Spec, Application Data",,,,,,,,,,,,,,,,,,,,,,,,,,,,,,,
52,24.469803,192.168.100.10,172.217.194.119,TLSv1.3,118,"Change Cipher Spec, Application Data",,,,,,,,,,,,,,,,,,,,,,,,,,,,,,,
53,24.470726,192.168.100.10,172.217.194.119,TLSv1.3,146,Application Data,,,,,,,,,,,,,,,,,,,,,,,,,,,,,,,
54,24.471365,192.168.100.10,172.217.194.119,TLSv1.3,435,Application Data,,,,,,,,,,,,,,,,,,,,,,,,,,,,,,,
55,24.498265,172.217.194.119,192.168.100.10,TLSv1.3,634,"Application Data, Application Data",,,,,,,,,,,,,,,,,,,,,,,,,,,,,,,
56,24.49827,172.217.194.119,192.168.100.10,TLSv1.3,85,Application Data,,,,,,,,,,,,,,,,,,,,,,,,,,,,,,,
57,24.498272,172.217.194.119,192.168.100.10,TLSv1.3,420,Application Data,,,,,,,,,,,,,,,,,,,,,,,,,,,,,,,
58,24.498456,192.168.100.10,172.217.194.119,TCP,54,50250  >  443 [ACK] Seq=1115 Ack=1190 Win=65024 Len=0,,,,,,,,,,,,,,,,,,,,,,,,,,,,,,,
59,24.499197,172.217.194.119,192.168.100.10,TLSv1.3,1466,Application Data,,,,,,,,,,,,,,,,,,,,,,,,,,,,,,,
60,24.4992,172.217.194.119,192.168.100.10,TLSv1.3,1466,Application Data,,,,,,,,,,,,,,,,,,,,,,,,,,,,,,,
61,24.499294,192.168.100.10,172.217.194.119,TCP,54,50250  >  443 [ACK] Seq=1115 Ack=4014 Win=66304 Len=0,,,,,,,,,,,,,,,,,,,,,,,,,,,,,,,
62,24.500198,172.217.194.119,192.168.100.10,TLSv1.3,1466,Application Data,,,,,,,,,,,,,,,,,,,,,,,,,,,,,,,
63,24.500201,172.217.194.119,192.168.100.10,TLSv1.3,1466,Application Data,,,,,,,,,,,,,,,,,,,,,,,,,,,,,,,
64,24.500203,172.217.194.119,192.168.100.10,TLSv1.3,1466,Application Data,,,,,,,,,,,,,,,,,,,,,,,,,,,,,,,
65,24.500209,172.217.194.119,192.168.100.10,TLSv1.3,1466,Application Data,,,,,,,,,,,,,,,,,,,,,,,,,,,,,,,
66,24.50028,192.168.100.10,172.217.194.119,TCP,54,50250  >  443 [ACK] Seq=1115 Ack=9662 Win=66304 Len=0,,,,,,,,,,,,,,,,,,,,,,,,,,,,,,,
67,24.512318,172.217.194.119,192.168.100.10,TLSv1.3,1466,Application Data,,,,,,,,,,,,,,,,,,,,,,,,,,,,,,,
68,24.512327,172.217.194.119,192.168.100.10,TLSv1.3,1466,Application Data,,,,,,,,,,,,,,,,,,,,,,,,,,,,,,,
69,24.512535,192.168.100.10,172.217.194.119,TCP,54,50250  >  443 [ACK] Seq=1115 Ack=12486 Win=66304 Len=0,,,,,,,,,,,,,,,,,,,,,,,,,,,,,,,
70,24.514671,192.168.100.10,172.217.194.119,TLSv1.3,85,Application Data,,,,,,,,,,,,,,,,,,,,,,,,,,,,,,,
71,24.525245,172.217.194.119,192.168.100.10,TLSv1.3,1466,Application Data,,,,,,,,,,,,,,,,,,,,,,,,,,,,,,,
72,24.525251,172.217.194.119,192.168.100.10,TLSv1.3,1466,Application Data,,,,,,,,,,,,,,,,,,,,,,,,,,,,,,,
73,24.525403,192.168.100.10,172.217.194.119,TCP,54,50250  >  443 [ACK] Seq=1146 Ack=15310 Win=66304 Len=0,,,,,,,,,,,,,,,,,,,,,,,,,,,,,,,
74,24.527234,172.217.194.119,192.168.100.10,TLSv1.3,1466,Application Data,,,,,,,,,,,,,,,,,,,,,,,,,,,,,,,
75,24.527239,172.217.194.119,192.168.100.10,TLSv1.3,1466,Application Data,,,,,,,,,,,,,,,,,,,,,,,,,,,,,,,
76,24.527371,192.168.100.10,172.217.194.119,TCP,54,50250  >  443 [ACK] Seq=1146 Ack=18134 Win=66304 Len=0,,,,,,,,,,,,,,,,,,,,,,,,,,,,,,,
77,24.52823,172.217.194.119,192.168.100.10,TLSv1.3,1466,Application Data,,,,,,,,,,,,,,,,,,,,,,,,,,,,,,,
78,24.528236,172.217.194.119,192.168.100.10,TLSv1.3,1466,Application Data,,,,,,,,,,,,,,,,,,,,,,,,,,,,,,,
79,24.528365,192.168.100.10,172.217.194.119,TCP,54,50250  >  443 [ACK] Seq=1146 Ack=20958 Win=66304 Len=0,,,,,,,,,,,,,,,,,,,,,,,,,,,,,,,
80,24.530214,172.217.194.119,192.168.100.10,TLSv1.3,1466,Application Data,,,,,,,,,,,,,,,,,,,,,,,,,,,,,,,
81,24.53022,172.217.194.119,192.168.100.10,TLSv1.3,1466,Application Data,,,,,,,,,,,,,,,,,,,,,,,,,,,,,,,
82,24.530346,192.168.100.10,172.217.194.119,TCP,54,50250  >  443 [ACK] Seq=1146 Ack=23782 Win=66304 Len=0,,,,,,,,,,,,,,,,,,,,,,,,,,,,,,,
83,24.532224,172.217.194.119,192.168.100.10,TLSv1.3,1466,Application Data,,,,,,,,,,,,,,,,,,,,,,,,,,,,,,,
84,24.532229,172.217.194.119,192.168.100.10,TLSv1.3,1466,Application Data,,,,,,,,,,,,,,,,,,,,,,,,,,,,,,,
85,24.532365,192.168.100.10,172.217.194.119,TCP,54,50250  >  443 [ACK] Seq=1146 Ack=26606 Win=66304 Len=0,,,,,,,,,,,,,,,,,,,,,,,,,,,,,,,
86,24.534229,172.217.194.119,192.168.100.10,TLSv1.3,1466,Application Data,,,,,,,,,,,,,,,,,,,,,,,,,,,,,,,
87,24.534235,172.217.194.119,192.168.100.10,TLSv1.3,1466,Application Data,,,,,,,,,,,,,,,,,,,,,,,,,,,,,,,
88,24.534366,192.168.100.10,172.217.194.119,TCP,54,50250  >  443 [ACK] Seq=1146 Ack=29430 Win=66304 Len=0,,,,,,,,,,,,,,,,,,,,,,,,,,,,,,,
89,24.537233,172.217.194.119,192.168.100.10,TLSv1.3,1466,Application Data,,,,,,,,,,,,,,,,,,,,,,,,,,,,,,,
90,24.537238,172.217.194.119,192.168.100.10,TLSv1.3,1466,Application Data,,,,,,,,,,,,,,,,,,,,,,,,,,,,,,,
91,24.537375,192.168.100.10,172.217.194.119,TCP,54,50250  >  443 [ACK] Seq=1146 Ack=32254 Win=66304 Len=0,,,,,,,,,,,,,,,,,,,,,,,,,,,,,,,
92,24.538207,172.217.194.119,192.168.100.10,TLSv1.3,1466,Application Data,,,,,,,,,,,,,,,,,,,,,,,,,,,,,,,
93,24.538212,172.217.194.119,192.168.100.10,TLSv1.3,1466,Application Data,,,,,,,,,,,,,,,,,,,,,,,,,,,,,,,
94,24.538301,192.168.100.10,172.217.194.119,TCP,54,50250  >  443 [ACK] Seq=1146 Ack=35078 Win=63488 Len=0,,,,,,,,,,,,,,,,,,,,,,,,,,,,,,,
95,24.540697,192.168.100.10,172.217.194.119,TCP,54,[TCP Window Update] 50250  >  443 [ACK] Seq=1146 Ack=35078 Win=66304 Len=0,,,,,,,,,,,,,,,,,,,,,,,,,,,,,,,
96,24.543727,172.217.194.119,192.168.100.10,TCP,56,[TCP Previous segment not captured] 443  >  50250 [ACK] Seq=36702 Ack=1146 Win=68096 Len=0,,,,,,,,,,,,,,,,,,,,,,,,,,,,,,,
97,24.552255,172.217.194.119,192.168.100.10,TCP,1466,[TCP Out-Of-Order] 443  >  50250 [ACK] Seq=35078 Ack=1115 Win=68096 Len=1412,,,,,,,,,,,,,,,,,,,,,,,,,,,,,,,
98,24.55226,172.217.194.119,192.168.100.10,TCP,266,"[TCP Retransmission] 443  >  50250 [PSH, ACK] Seq=36490 Ack=1115 Win=68096 Len=212",,,,,,,,,,,,,,,,,,,,,,,,,,,,,,,
99,24.55243,192.168.100.10,172.217.194.119,TCP,54,50250  >  443 [ACK] Seq=1146 Ack=36702 Win=66304 Len=0,,,,,,,,,,,,,,,,,,,,,,,,,,,,,,,
100,24.559212,192.168.100.10,172.217.194.119,TLSv1.3,93,Application Data,,,,,,,,,,,,,,,,,,,,,,,,,,,,,,,
101,24.584253,172.217.194.119,192.168.100.10,TCP,56,443  >  50250 [ACK] Seq=36702 Ack=1185 Win=68096 Len=0,,,,,,,,,,,,,,,,,,,,,,,,,,,,,,,
102,26.454143,192.168.100.10,74.125.68.190,TCP,54,"50249  >  443 [FIN, ACK] Seq=2548 Ack=1294 Win=65024 Len=0",,,,,,,,,,,,,,,,,,,,,,,,,,,,,,,
103,26.454924,192.168.100.10,172.217.194.119,TCP,54,"50250  >  443 [FIN, ACK] Seq=1185 Ack=36702 Win=66304 Len=0",,,,,,,,,,,,,,,,,,,,,,,,,,,,,,,
104,26.471302,74.125.68.190,192.168.100.10,TCP,54,"443  >  50249 [FIN, ACK] Seq=1294 Ack=2549 Win=72448 Len=0",,,,,,,,,,,,,,,,,,,,,,,,,,,,,,,
105,26.471452,192.168.100.10,74.125.68.190,TCP,54,50249  >  443 [ACK] Seq=2549 Ack=1295 Win=65024 Len=0,,,,,,,,,,,,,,,,,,,,,,,,,,,,,,,
106,26.481416,172.217.194.119,192.168.100.10,TCP,54,"443  >  50250 [FIN, ACK] Seq=36702 Ack=1186 Win=68096 Len=0",,,,,,,,,,,,,,,,,,,,,,,,,,,,,,,
107,26.481549,192.168.100.10,172.217.194.119,TCP,54,50250  >  443 [ACK] Seq=1186 Ack=36703 Win=66304 Len=0,,,,,,,,,,,,,,,,,,,,,,,,,,,,,,,
108,26.753427,192.168.100.10,74.125.68.190,TCP,66,50251  >  443 [SYN] Seq=0 Win=8192 Len=0 MSS=1460 WS=256 SACK_PERM=1,,,,,,,,,,,,,,,,,,,,,,,,,,,,,,,
109,26.772667,74.125.68.190,192.168.100.10,TCP,66,"443  >  50251 [SYN, ACK] Seq=0 Ack=1 Win=65535 Len=0 MSS=1412 SACK_PERM=1 WS=256",,,,,,,,,,,,,,,,,,,,,,,,,,,,,,,
110,26.772841,192.168.100.10,74.125.68.190,TCP,54,50251  >  443 [ACK] Seq=1 Ack=1 Win=66304 Len=0,,,,,,,,,,,,,,,,,,,,,,,,,,,,,,,
111,26.774223,192.168.100.10,74.125.68.190,TLSv1.3,635,Client Hello,,,,,,,,,,,,,,,,,,,,,,,,,,,,,,,
112,26.794318,74.125.68.190,192.168.100.10,TCP,54,443  >  50251 [ACK] Seq=1 Ack=582 Win=66816 Len=0,,,,,,,,,,,,,,,,,,,,,,,,,,,,,,,
113,26.812048,74.125.68.190,192.168.100.10,TLSv1.3,266,"Server Hello, Change Cipher Spec, Application Data",,,,,,,,,,,,,,,,,,,,,,,,,,,,,,,
114,26.820229,192.168.100.10,74.125.68.190,TLSv1.3,118,"Change Cipher Spec, Application Data",,,,,,,,,,,,,,,,,,,,,,,,,,,,,,,
115,26.821013,192.168.100.10,74.125.68.190,TLSv1.3,146,Application Data,,,,,,,,,,,,,,,,,,,,,,,,,,,,,,,
116,26.822442,192.168.100.10,74.125.68.190,TCP,1466,50251  >  443 [ACK] Seq=738 Ack=213 Win=66048 Len=1412 [TCP segment of a reassembled PDU],,,,,,,,,,,,,,,,,,,,,,,,,,,,,,,
117,26.822469,192.168.100.10,74.125.68.190,TLSv1.3,585,Application Data,,,,,,,,,,,,,,,,,,,,,,,,,,,,,,,
118,26.841731,74.125.68.190,192.168.100.10,TCP,56,[TCP Previous segment not captured] 443  >  50251 [ACK] Seq=824 Ack=2681 Win=72448 Len=0,,,,,,,,,,,,,,,,,,,,,,,,,,,,,,,
119,26.848184,74.125.68.190,192.168.100.10,TCP,634,"[TCP Out-Of-Order] 443  >  50251 [PSH, ACK] Seq=213 Ack=646 Win=66816 Len=580",,,,,,,,,,,,,,,,,,,,,,,,,,,,,,,
120,26.848194,74.125.68.190,192.168.100.10,TCP,85,"[TCP Retransmission] 443  >  50251 [PSH, ACK] Seq=793 Ack=738 Win=66816 Len=31",,,,,,,,,,,,,,,,,,,,,,,,,,,,,,,
121,26.848195,74.125.68.190,192.168.100.10,TLSv1.3,501,Application Data,,,,,,,,,,,,,,,,,,,,,,,,,,,,,,,
122,26.848196,74.125.68.190,192.168.100.10,TLSv1.3,85,Application Data,,,,,,,,,,,,,,,,,,,,,,,,,,,,,,,
123,26.848473,192.168.100.10,74.125.68.190,TCP,54,50251  >  443 [ACK] Seq=2681 Ack=1302 Win=65024 Len=0,,,,,,,,,,,,,,,,,,,,,,,,,,,,,,,
124,26.851975,192.168.100.10,74.125.68.190,TLSv1.3,85,Application Data,,,,,,,,,,,,,,,,,,,,,,,,,,,,,,,
125,26.8617,74.125.68.190,192.168.100.10,TLSv1.3,93,Application Data,,,,,,,,,,,,,,,,,,,,,,,,,,,,,,,
126,26.8624,192.168.100.10,74.125.68.190,TLSv1.3,93,Application Data,,,,,,,,,,,,,,,,,,,,,,,,,,,,,,,
127,26.876335,74.125.68.190,192.168.100.10,TCP,56,443  >  50251 [ACK] Seq=1341 Ack=2712 Win=72448 Len=0,,,,,,,,,,,,,,,,,,,,,,,,,,,,,,,
128,26.881324,74.125.68.190,192.168.100.10,TCP,56,443  >  50251 [ACK] Seq=1341 Ack=2751 Win=72448 Len=0,,,,,,,,,,,,,,,,,,,,,,,,,,,,,,,
129,30.010947,fe80::ffff:ffff:fffe,ff02::2,ICMPv6,103,Router Solicitation,,,,,,,,,,,,,,,,,,,,,,,,,,,,,,,
130,34.921423,192.168.100.10,69.171.250.60,TLSv1.2,85,Application Data,,,,,,,,,,,,,,,,,,,,,,,,,,,,,,,
131,34.94254,69.171.250.60,192.168.100.10,TCP,56,443  >  50231 [ACK] Seq=39 Ack=63 Win=246 Len=0,,,,,,,,,,,,,,,,,,,,,,,,,,,,,,,
132,35.191504,69.171.250.60,192.168.100.10,TLSv1.2,92,Application Data,,,,,,,,,,,,,,,,,,,,,,,,,,,,,,,
133,35.351841,69.171.250.60,192.168.100.10,TCP,92,"[TCP Retransmission] 443  >  50231 [PSH, ACK] Seq=39 Ack=63 Win=246 Len=38",,,,,,,,,,,,,,,,,,,,,,,,,,,,,,,
134,35.351975,192.168.100.10,69.171.250.60,TCP,66,50231  >  443 [ACK] Seq=63 Ack=77 Win=932 Len=0 SLE=39 SRE=77,,,,,,,,,,,,,,,,,,,,,,,,,,,,,,,
135,35.911873,69.171.250.60,192.168.100.10,TLSv1.2,160,Application Data,,,,,,,,,,,,,,,,,,,,,,,,,,,,,,,
136,36.07158,69.171.250.60,192.168.100.10,TCP,160,"[TCP Retransmission] 443  >  50231 [PSH, ACK] Seq=77 Ack=63 Win=246 Len=106",,,,,,,,,,,,,,,,,,,,,,,,,,,,,,,
137,36.071681,192.168.100.10,69.171.250.60,TCP,66,50231  >  443 [ACK] Seq=63 Ack=183 Win=932 Len=0 SLE=77 SRE=183,,,,,,,,,,,,,,,,,,,,,,,,,,,,,,,
138,36.112976,192.168.100.10,74.125.68.190,TLSv1.3,1389,Application Data,,,,,,,,,,,,,,,,,,,,,,,,,,,,,,,
139,36.131828,74.125.68.190,192.168.100.10,TCP,56,443  >  50251 [ACK] Seq=1341 Ack=4086 Win=75264 Len=0,,,,,,,,,,,,,,,,,,,,,,,,,,,,,,,
140,36.493413,74.125.68.190,192.168.100.10,TLSv1.3,494,Application Data,,,,,,,,,,,,,,,,,,,,,,,,,,,,,,,
141,36.493418,74.125.68.190,192.168.100.10,TLSv1.3,1466,Application Data,,,,,,,,,,,,,,,,,,,,,,,,,,,,,,,
142,36.49342,74.125.68.190,192.168.100.10,TLSv1.3,1466,Application Data,,,,,,,,,,,,,,,,,,,,,,,,,,,,,,,
143,36.493574,192.168.100.10,74.125.68.190,TCP,54,50251  >  443 [ACK] Seq=4086 Ack=4605 Win=66304 Len=0,,,,,,,,,,,,,,,,,,,,,,,,,,,,,,,
144,36.495023,74.125.68.190,192.168.100.10,TLSv1.3,1466,Application Data,,,,,,,,,,,,,,,,,,,,,,,,,,,,,,,
145,36.495027,74.125.68.190,192.168.100.10,TLSv1.3,1466,Application Data,,,,,,,,,,,,,,,,,,,,,,,,,,,,,,,
146,36.495133,192.168.100.10,74.125.68.190,TCP,54,50251  >  443 [ACK] Seq=4086 Ack=7429 Win=66304 Len=0,,,,,,,,,,,,,,,,,,,,,,,,,,,,,,,
147,36.495511,74.125.68.190,192.168.100.10,TLSv1.3,1466,Application Data,,,,,,,,,,,,,,,,,,,,,,,,,,,,,,,
148,36.495518,74.125.68.190,192.168.100.10,TLSv1.3,1466,Application Data,,,,,,,,,,,,,,,,,,,,,,,,,,,,,,,
149,36.495571,192.168.100.10,74.125.68.190,TCP,54,50251  >  443 [ACK] Seq=4086 Ack=10253 Win=66304 Len=0,,,,,,,,,,,,,,,,,,,,,,,,,,,,,,,
150,36.496863,74.125.68.190,192.168.100.10,TLSv1.3,1466,Application Data,,,,,,,,,,,,,,,,,,,,,,,,,,,,,,,
151,36.496868,74.125.68.190,192.168.100.10,TLSv1.3,1466,Application Data,,,,,,,,,,,,,,,,,,,,,,,,,,,,,,,
152,36.496984,192.168.100.10,74.125.68.190,TCP,54,50251  >  443 [ACK] Seq=4086 Ack=13077 Win=66304 Len=0,,,,,,,,,,,,,,,,,,,,,,,,,,,,,,,
153,36.498113,74.125.68.190,192.168.100.10,TLSv1.3,1466,"Application Data, Application Data",,,,,,,,,,,,,,,,,,,,,,,,,,,,,,,
154,36.498118,74.125.68.190,192.168.100.10,TLSv1.3,1466,Application Data [TCP segment of a reassembled PDU],,,,,,,,,,,,,,,,,,,,,,,,,,,,,,,
155,36.498228,192.168.100.10,74.125.68.190,TCP,54,50251  >  443 [ACK] Seq=4086 Ack=15901 Win=66304 Len=0,,,,,,,,,,,,,,,,,,,,,,,,,,,,,,,
156,36.4988,74.125.68.190,192.168.100.10,TLSv1.3,1466,Application Data [TCP segment of a reassembled PDU],,,,,,,,,,,,,,,,,,,,,,,,,,,,,,,
157,36.498802,74.125.68.190,192.168.100.10,TLSv1.3,1466,Application Data [TCP segment of a reassembled PDU],,,,,,,,,,,,,,,,,,,,,,,,,,,,,,,
158,36.498863,192.168.100.10,74.125.68.190,TCP,54,50251  >  443 [ACK] Seq=4086 Ack=18725 Win=66304 Len=0,,,,,,,,,,,,,,,,,,,,,,,,,,,,,,,
159,36.500458,74.125.68.190,192.168.100.10,TLSv1.3,1466,Application Data [TCP segment of a reassembled PDU],,,,,,,,,,,,,,,,,,,,,,,,,,,,,,,
160,36.500464,74.125.68.190,192.168.100.10,TLSv1.3,1466,Application Data [TCP segment of a reassembled PDU],,,,,,,,,,,,,,,,,,,,,,,,,,,,,,,
161,36.500583,192.168.100.10,74.125.68.190,TCP,54,50251  >  443 [ACK] Seq=4086 Ack=21549 Win=66304 Len=0,,,,,,,,,,,,,,,,,,,,,,,,,,,,,,,
162,36.501177,74.125.68.190,192.168.100.10,TLSv1.3,1466,Application Data [TCP segment of a reassembled PDU],,,,,,,,,,,,,,,,,,,,,,,,,,,,,,,
163,36.501181,74.125.68.190,192.168.100.10,TLSv1.3,1466,Application Data [TCP segment of a reassembled PDU],,,,,,,,,,,,,,,,,,,,,,,,,,,,,,,
164,36.50124,192.168.100.10,74.125.68.190,TCP,54,50251  >  443 [ACK] Seq=4086 Ack=24373 Win=66304 Len=0,,,,,,,,,,,,,,,,,,,,,,,,,,,,,,,
165,36.50249,74.125.68.190,192.168.100.10,TLSv1.3,1466,Application Data [TCP segment of a reassembled PDU],,,,,,,,,,,,,,,,,,,,,,,,,,,,,,,
166,36.502495,74.125.68.190,192.168.100.10,TLSv1.3,1466,Application Data [TCP segment of a reassembled PDU],,,,,,,,,,,,,,,,,,,,,,,,,,,,,,,
167,36.50261,192.168.100.10,74.125.68.190,TCP,54,50251  >  443 [ACK] Seq=4086 Ack=27197 Win=66304 Len=0,,,,,,,,,,,,,,,,,,,,,,,,,,,,,,,
168,36.522167,74.125.68.190,192.168.100.10,TLSv1.3,1466,Application Data [TCP segment of a reassembled PDU],,,,,,,,,,,,,,,,,,,,,,,,,,,,,,,
169,36.522171,74.125.68.190,192.168.100.10,TLSv1.3,1466,Application Data [TCP segment of a reassembled PDU],,,,,,,,,,,,,,,,,,,,,,,,,,,,,,,
170,36.522173,74.125.68.190,192.168.100.10,TLSv1.3,446,"Application Data, Application Data, Application Data",,,,,,,,,,,,,,,,,,,,,,,,,,,,,,,
171,36.522321,192.168.100.10,74.125.68.190,TCP,54,50251  >  443 [ACK] Seq=4086 Ack=30413 Win=66304 Len=0,,,,,,,,,,,,,,,,,,,,,,,,,,,,,,,
172,36.523247,192.168.100.10,74.125.68.190,TLSv1.3,93,Application Data,,,,,,,,,,,,,,,,,,,,,,,,,,,,,,,
173,36.540864,74.125.68.190,192.168.100.10,TCP,56,443  >  50251 [ACK] Seq=30413 Ack=4125 Win=75264 Len=0,,,,,,,,,,,,,,,,,,,,,,,,,,,,,,,
174,37.772082,fe80::1,ff05::c,SSDP,188,M-SEARCH * HTTP/1.1 ,,,,,,,,,,,,,,,,,,,,,,,,,,,,,,,
175,38.031774,fe80::1,ff05::c,SSDP,188,M-SEARCH * HTTP/1.1 ,,,,,,,,,,,,,,,,,,,,,,,,,,,,,,,
176,38.292007,fe80::1,ff02::c,SSDP,188,M-SEARCH * HTTP/1.1 ,,,,,,,,,,,,,,,,,,,,,,,,,,,,,,,
177,38.518988,192.168.100.10,239.255.255.250,SSDP,216,M-SEARCH * HTTP/1.1 ,,,,,,,,,,,,,,,,,,,,,,,,,,,,,,,
178,38.551833,fe80::1,ff02::c,SSDP,188,M-SEARCH * HTTP/1.1 ,,,,,,,,,,,,,,,,,,,,,,,,,,,,,,,
179,38.831622,192.168.100.1,239.255.255.250,SSDP,174,M-SEARCH * HTTP/1.1 ,,,,,,,,,,,,,,,,,,,,,,,,,,,,,,,
180,39.091997,192.168.100.1,239.255.255.250,SSDP,174,M-SEARCH * HTTP/1.1 ,,,,,,,,,,,,,,,,,,,,,,,,,,,,,,,
181,39.331897,fe80::1,ff05::c,SSDP,189,M-SEARCH * HTTP/1.1 ,,,,,,,,,,,,,,,,,,,,,,,,,,,,,,,
182,39.520348,192.168.100.10,239.255.255.250,SSDP,216,M-SEARCH * HTTP/1.1 ,,,,,,,,,,,,,,,,,,,,,,,,,,,,,,,
183,39.592681,fe80::1,ff05::c,SSDP,189,M-SEARCH * HTTP/1.1 ,,,,,,,,,,,,,,,,,,,,,,,,,,,,,,,
184,39.852055,fe80::1,ff02::c,SSDP,189,M-SEARCH * HTTP/1.1 ,,,,,,,,,,,,,,,,,,,,,,,,,,,,,,,
185,40.112046,fe80::1,ff02::c,SSDP,189,M-SEARCH * HTTP/1.1 ,,,,,,,,,,,,,,,,,,,,,,,,,,,,,,,
186,40.392087,192.168.100.1,239.255.255.250,SSDP,175,M-SEARCH * HTTP/1.1 ,,,,,,,,,,,,,,,,,,,,,,,,,,,,,,,
187,40.521205,192.168.100.10,239.255.255.250,SSDP,216,M-SEARCH * HTTP/1.1 ,,,,,,,,,,,,,,,,,,,,,,,,,,,,,,,
188,40.651514,192.168.100.1,239.255.255.250,SSDP,175,M-SEARCH * HTTP/1.1 ,,,,,,,,,,,,,,,,,,,,,,,,,,,,,,,
189,41.521303,192.168.100.10,239.255.255.250,SSDP,216,M-SEARCH * HTTP/1.1 ,,,,,,,,,,,,,,,,,,,,,,,,,,,,,,,
190,42.445605,69.171.250.60,192.168.100.10,TLSv1.2,141,Application Data,,,,,,,,,,,,,,,,,,,,,,,,,,,,,,,
191,42.445609,69.171.250.60,192.168.100.10,TLSv1.2,141,Application Data,,,,,,,,,,,,,,,,,,,,,,,,,,,,,,,
192,42.445759,192.168.100.10,69.171.250.60,TCP,54,50231  >  443 [ACK] Seq=63 Ack=357 Win=931 Len=0,,,,,,,,,,,,,,,,,,,,,,,,,,,,,,,
193,42.446006,69.171.250.60,192.168.100.10,TLSv1.2,155,Application Data,,,,,,,,,,,,,,,,,,,,,,,,,,,,,,,
194,42.446008,69.171.250.60,192.168.100.10,TLSv1.2,155,Application Data,,,,,,,,,,,,,,,,,,,,,,,,,,,,,,,
195,42.446047,192.168.100.10,69.171.250.60,TCP,54,50231  >  443 [ACK] Seq=63 Ack=559 Win=930 Len=0,,,,,,,,,,,,,,,,,,,,,,,,,,,,,,,
196,42.446719,69.171.250.60,192.168.100.10,TLSv1.2,155,Application Data,,,,,,,,,,,,,,,,,,,,,,,,,,,,,,,
197,42.446721,69.171.250.60,192.168.100.10,TLSv1.2,155,Application Data,,,,,,,,,,,,,,,,,,,,,,,,,,,,,,,
198,42.4468,192.168.100.10,69.171.250.60,TCP,54,50231  >  443 [ACK] Seq=63 Ack=761 Win=930 Len=0,,,,,,,,,,,,,,,,,,,,,,,,,,,,,,,
199,42.447042,69.171.250.60,192.168.100.10,TLSv1.2,156,Application Data,,,,,,,,,,,,,,,,,,,,,,,,,,,,,,,
200,42.447043,69.171.250.60,192.168.100.10,TLSv1.2,156,Application Data,,,,,,,,,,,,,,,,,,,,,,,,,,,,,,,
201,42.447085,192.168.100.10,69.171.250.60,TCP,54,50231  >  443 [ACK] Seq=63 Ack=965 Win=935 Len=0,,,,,,,,,,,,,,,,,,,,,,,,,,,,,,,
202,42.461958,69.171.250.60,192.168.100.10,TLSv1.2,155,Application Data,,,,,,,,,,,,,,,,,,,,,,,,,,,,,,,
203,42.621547,69.171.250.60,192.168.100.10,TCP,155,"[TCP Retransmission] 443  >  50231 [PSH, ACK] Seq=965 Ack=63 Win=246 Len=101",,,,,,,,,,,,,,,,,,,,,,,,,,,,,,,
204,42.621651,192.168.100.10,69.171.250.60,TCP,66,50231  >  443 [ACK] Seq=63 Ack=1066 Win=934 Len=0 SLE=965 SRE=1066,,,,,,,,,,,,,,,,,,,,,,,,,,,,,,,
205,45.806185,192.168.100.10,74.125.68.190,TLSv1.3,983,Application Data,,,,,,,,,,,,,,,,,,,,,,,,,,,,,,,
206,45.825867,74.125.68.190,192.168.100.10,TCP,54,443  >  50251 [ACK] Seq=30413 Ack=5054 Win=78080 Len=0,,,,,,,,,,,,,,,,,,,,,,,,,,,,,,,
207,45.831579,74.125.68.190,192.168.100.10,TLSv1.3,123,Application Data,,,,,,,,,,,,,,,,,,,,,,,,,,,,,,,
208,45.831583,74.125.68.190,192.168.100.10,TLSv1.3,85,Application Data,,,,,,,,,,,,,,,,,,,,,,,,,,,,,,,
209,45.831733,192.168.100.10,74.125.68.190,TCP,54,50251  >  443 [ACK] Seq=5054 Ack=30513 Win=66048 Len=0,,,,,,,,,,,,,,,,,,,,,,,,,,,,,,,
210,45.851466,74.125.68.190,192.168.100.10,TLSv1.3,93,Application Data,,,,,,,,,,,,,,,,,,,,,,,,,,,,,,,
211,45.8538,192.168.100.10,74.125.68.190,TLSv1.3,93,Application Data,,,,,,,,,,,,,,,,,,,,,,,,,,,,,,,
212,45.876896,74.125.68.190,192.168.100.10,TCP,56,443  >  50251 [ACK] Seq=30552 Ack=5093 Win=78080 Len=0,,,,,,,,,,,,,,,,,,,,,,,,,,,,,,,
213,46.004744,192.168.100.10,74.125.68.190,TCP,1466,50251  >  443 [ACK] Seq=5093 Ack=30552 Win=66048 Len=1412 [TCP segment of a reassembled PDU],,,,,,,,,,,,,,,,,,,,,,,,,,,,,,,
214,46.004775,192.168.100.10,74.125.68.190,TLSv1.3,480,Application Data,,,,,,,,,,,,,,,,,,,,,,,,,,,,,,,
215,46.008115,192.168.100.10,74.125.68.190,TLSv1.3,669,Application Data,,,,,,,,,,,,,,,,,,,,,,,,,,,,,,,
216,46.023445,74.125.68.190,192.168.100.10,TCP,56,443  >  50251 [ACK] Seq=30552 Ack=6505 Win=80896 Len=0,,,,,,,,,,,,,,,,,,,,,,,,,,,,,,,
217,46.024435,74.125.68.190,192.168.100.10,TCP,56,443  >  50251 [ACK] Seq=30552 Ack=6931 Win=83712 Len=0,,,,,,,,,,,,,,,,,,,,,,,,,,,,,,,
218,46.027451,74.125.68.190,192.168.100.10,TCP,56,443  >  50251 [ACK] Seq=30552 Ack=7546 Win=86528 Len=0,,,,,,,,,,,,,,,,,,,,,,,,,,,,,,,
219,46.032465,74.125.68.190,192.168.100.10,TLSv1.3,121,Application Data,,,,,,,,,,,,,,,,,,,,,,,,,,,,,,,
220,46.032469,74.125.68.190,192.168.100.10,TLSv1.3,85,Application Data,,,,,,,,,,,,,,,,,,,,,,,,,,,,,,,
221,46.032613,192.168.100.10,74.125.68.190,TCP,54,50251  >  443 [ACK] Seq=7546 Ack=30650 Win=66048 Len=0,,,,,,,,,,,,,,,,,,,,,,,,,,,,,,,
222,46.051445,74.125.68.190,192.168.100.10,TLSv1.3,93,Application Data,,,,,,,,,,,,,,,,,,,,,,,,,,,,,,,
223,46.054612,192.168.100.10,74.125.68.190,TLSv1.3,93,Application Data,,,,,,,,,,,,,,,,,,,,,,,,,,,,,,,
224,46.078462,74.125.68.190,192.168.100.10,TCP,56,443  >  50251 [ACK] Seq=30689 Ack=7585 Win=86528 Len=0,,,,,,,,,,,,,,,,,,,,,,,,,,,,,,,
225,46.135132,192.168.100.10,192.168.100.1,DNS,97,Standard query 0x9982 A r2---sn-2uuxa3vh-2ah6.googlevideo.com,,,,,,,,,,,,,,,,,,,,,,,,,,,,,,,
226,46.16245,192.168.100.1,192.168.100.10,DNS,147,Standard query response 0x9982 A r2---sn-2uuxa3vh-2ah6.googlevideo.com CNAME r2.sn-2uuxa3vh-2ah6.googlevideo.com A 36.92.238.237,,,,,,,,,,,,,,,,,,,,,,,,,,,,,,,
227,46.164066,192.168.100.10,36.92.238.237,TCP,66,50252  >  443 [SYN] Seq=0 Win=8192 Len=0 MSS=1460 WS=256 SACK_PERM=1,,,,,,,,,,,,,,,,,,,,,,,,,,,,,,,
228,46.167856,36.92.238.237,192.168.100.10,TCP,66,"443  >  50252 [SYN, ACK] Seq=0 Ack=1 Win=65535 Len=0 MSS=1412 SACK_PERM=1 WS=256",,,,,,,,,,,,,,,,,,,,,,,,,,,,,,,
229,46.168048,192.168.100.10,36.92.238.237,TCP,54,50252  >  443 [ACK] Seq=1 Ack=1 Win=66304 Len=0,,,,,,,,,,,,,,,,,,,,,,,,,,,,,,,
230,46.169789,192.168.100.10,36.92.238.237,TLSv1.3,571,Client Hello,,,,,,,,,,,,,,,,,,,,,,,,,,,,,,,
231,46.176457,36.92.238.237,192.168.100.10,TCP,54,443  >  50252 [ACK] Seq=1 Ack=518 Win=66816 Len=0,,,,,,,,,,,,,,,,,,,,,,,,,,,,,,,
232,46.188592,36.92.238.237,192.168.100.10,TLSv1.3,1466,"Server Hello, Change Cipher Spec",,,,,,,,,,,,,,,,,,,,,,,,,,,,,,,
233,46.188596,36.92.238.237,192.168.100.10,TCP,1466,443  >  50252 [ACK] Seq=1413 Ack=518 Win=66816 Len=1412 [TCP segment of a reassembled PDU],,,,,,,,,,,,,,,,,,,,,,,,,,,,,,,
234,46.188598,36.92.238.237,192.168.100.10,TLSv1.3,535,Application Data,,,,,,,,,,,,,,,,,,,,,,,,,,,,,,,
235,46.188753,192.168.100.10,36.92.238.237,TCP,54,50252  >  443 [ACK] Seq=518 Ack=3306 Win=66304 Len=0,,,,,,,,,,,,,,,,,,,,,,,,,,,,,,,
236,46.197473,36.92.238.237,192.168.100.10,TCP,535,"[TCP Spurious Retransmission] 443  >  50252 [PSH, ACK] Seq=2825 Ack=518 Win=66816 Len=481[Reassembly error, protocol TCP: New fragment overlaps old data (retransmission?)]",,,,,,,,,,,,,,,,,,,,,,,,,,,,,,,
237,46.197477,74.125.68.190,192.168.100.10,TLSv1.3,443,Application Data,,,,,,,,,,,,,,,,,,,,,,,,,,,,,,,
238,46.197478,74.125.68.190,192.168.100.10,TLSv1.3,1466,Application Data,,,,,,,,,,,,,,,,,,,,,,,,,,,,,,,
239,46.197582,192.168.100.10,36.92.238.237,TCP,66,[TCP Dup ACK 235#1] 50252  >  443 [ACK] Seq=518 Ack=3306 Win=66304 Len=0 SLE=2825 SRE=3306,,,,,,,,,,,,,,,,,,,,,,,,,,,,,,,
240,46.197775,192.168.100.10,74.125.68.190,TCP,54,50251  >  443 [ACK] Seq=7585 Ack=32490 Win=66304 Len=0,,,,,,,,,,,,,,,,,,,,,,,,,,,,,,,
241,46.198455,74.125.68.190,192.168.100.10,TLSv1.3,1466,Application Data,,,,,,,,,,,,,,,,,,,,,,,,,,,,,,,
242,46.198463,74.125.68.190,192.168.100.10,TLSv1.3,1466,Application Data,,,,,,,,,,,,,,,,,,,,,,,,,,,,,,,
243,46.198465,74.125.68.190,192.168.100.10,TLSv1.3,1466,Application Data,,,,,,,,,,,,,,,,,,,,,,,,,,,,,,,
244,46.198467,74.125.68.190,192.168.100.10,TLSv1.3,1466,Application Data,,,,,,,,,,,,,,,,,,,,,,,,,,,,,,,
245,46.198551,192.168.100.10,74.125.68.190,TCP,54,50251  >  443 [ACK] Seq=7585 Ack=38138 Win=66304 Len=0,,,,,,,,,,,,,,,,,,,,,,,,,,,,,,,
246,46.199526,74.125.68.190,192.168.100.10,TLSv1.3,1466,Application Data,,,,,,,,,,,,,,,,,,,,,,,,,,,,,,,
247,46.199531,74.125.68.190,192.168.100.10,TLSv1.3,1466,Application Data,,,,,,,,,,,,,,,,,,,,,,,,,,,,,,,
248,46.199533,74.125.68.190,192.168.100.10,TLSv1.3,1466,Application Data,,,,,,,,,,,,,,,,,,,,,,,,,,,,,,,
249,46.199534,74.125.68.190,192.168.100.10,TLSv1.3,1466,"Application Data, Application Data",,,,,,,,,,,,,,,,,,,,,,,,,,,,,,,
250,46.199667,192.168.100.10,74.125.68.190,TCP,54,50251  >  443 [ACK] Seq=7585 Ack=43786 Win=61952 Len=0,,,,,,,,,,,,,,,,,,,,,,,,,,,,,,,
251,46.203791,192.168.100.10,36.92.238.237,TLSv1.3,118,"Change Cipher Spec, Application Data",,,,,,,,,,,,,,,,,,,,,,,,,,,,,,,
252,46.206358,192.168.100.10,74.125.68.190,TCP,54,[TCP Window Update] 50251  >  443 [ACK] Seq=7585 Ack=43786 Win=66304 Len=0,,,,,,,,,,,,,,,,,,,,,,,,,,,,,,,
253,46.210686,192.168.100.10,36.92.238.237,TCP,1466,50252  >  443 [ACK] Seq=582 Ack=3306 Win=66304 Len=1412 [TCP segment of a reassembled PDU],,,,,,,,,,,,,,,,,,,,,,,,,,,,,,,
254,46.210718,192.168.100.10,36.92.238.237,TLSv1.3,199,Application Data,,,,,,,,,,,,,,,,,,,,,,,,,,,,,,,
255,46.214491,74.125.68.190,192.168.100.10,TLSv1.3,1466,Application Data [TCP segment of a reassembled PDU],,,,,,,,,,,,,,,,,,,,,,,,,,,,,,,
256,46.214496,74.125.68.190,192.168.100.10,TLSv1.3,1056,Application Data,,,,,,,,,,,,,,,,,,,,,,,,,,,,,,,
257,46.214498,74.125.68.190,192.168.100.10,TLSv1.3,85,Application Data,,,,,,,,,,,,,,,,,,,,,,,,,,,,,,,
258,46.214499,74.125.68.190,192.168.100.10,TLSv1.3,93,Application Data,,,,,,,,,,,,,,,,,,,,,,,,,,,,,,,
259,46.214656,192.168.100.10,74.125.68.190,TCP,54,50251  >  443 [ACK] Seq=7585 Ack=46270 Win=66304 Len=0,,,,,,,,,,,,,,,,,,,,,,,,,,,,,,,
260,46.215411,36.92.238.237,192.168.100.10,TCP,56,443  >  50252 [ACK] Seq=3306 Ack=582 Win=66816 Len=0,,,,,,,,,,,,,,,,,,,,,,,,,,,,,,,
261,46.217143,192.168.100.10,74.125.68.190,TLSv1.3,93,Application Data,,,,,,,,,,,,,,,,,,,,,,,,,,,,,,,
262,46.21792,36.92.238.237,192.168.100.10,TCP,56,443  >  50252 [ACK] Seq=3306 Ack=1994 Win=69632 Len=0,,,,,,,,,,,,,,,,,,,,,,,,,,,,,,,
263,46.218759,36.92.238.237,192.168.100.10,TCP,56,443  >  50252 [ACK] Seq=3306 Ack=2139 Win=72448 Len=0,,,,,,,,,,,,,,,,,,,,,,,,,,,,,,,
264,46.236464,74.125.68.190,192.168.100.10,TCP,56,443  >  50251 [ACK] Seq=46270 Ack=7624 Win=86528 Len=0,,,,,,,,,,,,,,,,,,,,,,,,,,,,,,,
265,46.258439,36.92.238.237,192.168.100.10,TLSv1.3,1466,Application Data,,,,,,,,,,,,,,,,,,,,,,,,,,,,,,,
266,46.258443,36.92.238.237,192.168.100.10,TLSv1.3,1151,Application Data,,,,,,,,,,,,,,,,,,,,,,,,,,,,,,,
267,46.258592,192.168.100.10,36.92.238.237,TCP,54,50252  >  443 [ACK] Seq=2139 Ack=5815 Win=66304 Len=0,,,,,,,,,,,,,,,,,,,,,,,,,,,,,,,
268,46.272451,36.92.238.237,192.168.100.10,TCP,1151,"[TCP Spurious Retransmission] 443  >  50252 [PSH, ACK] Seq=4718 Ack=2139 Win=72448 Len=1097[Reassembly error, protocol TCP: New fragment overlaps old data (retransmission?)]",,,,,,,,,,,,,,,,,,,,,,,,,,,,,,,
269,46.272569,192.168.100.10,36.92.238.237,TCP,66,[TCP Dup ACK 267#1] 50252  >  443 [ACK] Seq=2139 Ack=5815 Win=66304 Len=0 SLE=4718 SRE=5815,,,,,,,,,,,,,,,,,,,,,,,,,,,,,,,
270,46.313638,192.168.100.10,74.125.68.190,TLSv1.3,1031,Application Data,,,,,,,,,,,,,,,,,,,,,,,,,,,,,,,
271,46.32792,192.168.100.10,192.168.100.1,DNS,97,Standard query 0xc388 A r1---sn-2uuxa3vh-2ahz.googlevideo.com,,,,,,,,,,,,,,,,,,,,,,,,,,,,,,,
272,46.333461,74.125.68.190,192.168.100.10,TCP,56,443  >  50251 [ACK] Seq=46270 Ack=8601 Win=89344 Len=0,,,,,,,,,,,,,,,,,,,,,,,,,,,,,,,
273,46.338486,192.168.100.1,192.168.100.10,DNS,147,Standard query response 0xc388 A r1---sn-2uuxa3vh-2ahz.googlevideo.com CNAME r1.sn-2uuxa3vh-2ahz.googlevideo.com A 36.92.238.204,,,,,,,,,,,,,,,,,,,,,,,,,,,,,,,
274,46.338491,74.125.68.190,192.168.100.10,TLSv1.3,123,Application Data,,,,,,,,,,,,,,,,,,,,,,,,,,,,,,,
275,46.349405,192.168.100.10,36.92.238.204,TCP,66,50253  >  443 [SYN] Seq=0 Win=8192 Len=0 MSS=1460 WS=256 SACK_PERM=1,,,,,,,,,,,,,,,,,,,,,,,,,,,,,,,
276,46.350105,192.168.100.10,36.92.238.204,TCP,66,50254  >  443 [SYN] Seq=0 Win=8192 Len=0 MSS=1460 WS=256 SACK_PERM=1,,,,,,,,,,,,,,,,,,,,,,,,,,,,,,,
277,46.352474,74.125.68.190,192.168.100.10,TLSv1.3,85,Application Data,,,,,,,,,,,,,,,,,,,,,,,,,,,,,,,
278,46.352478,74.125.68.190,192.168.100.10,TLSv1.3,93,Application Data,,,,,,,,,,,,,,,,,,,,,,,,,,,,,,,
279,46.352601,192.168.100.10,74.125.68.190,TCP,54,50251  >  443 [ACK] Seq=8601 Ack=46409 Win=66048 Len=0,,,,,,,,,,,,,,,,,,,,,,,,,,,,,,,
280,46.354462,36.92.238.204,192.168.100.10,TCP,66,"443  >  50253 [SYN, ACK] Seq=0 Ack=1 Win=65535 Len=0 MSS=1412 SACK_PERM=1 WS=256",,,,,,,,,,,,,,,,,,,,,,,,,,,,,,,
281,46.354639,192.168.100.10,36.92.238.204,TCP,54,50253  >  443 [ACK] Seq=1 Ack=1 Win=66304 Len=0,,,,,,,,,,,,,,,,,,,,,,,,,,,,,,,
282,46.355427,36.92.238.204,192.168.100.10,TCP,66,"443  >  50254 [SYN, ACK] Seq=0 Ack=1 Win=65535 Len=0 MSS=1412 SACK_PERM=1 WS=256",,,,,,,,,,,,,,,,,,,,,,,,,,,,,,,
283,46.355559,192.168.100.10,36.92.238.204,TCP,54,50254  >  443 [ACK] Seq=1 Ack=1 Win=66304 Len=0,,,,,,,,,,,,,,,,,,,,,,,,,,,,,,,
284,46.400844,192.168.100.10,36.92.238.204,TLSv1.3,571,Client Hello,,,,,,,,,,,,,,,,,,,,,,,,,,,,,,,
285,46.402363,192.168.100.10,36.92.238.204,TLSv1.3,571,Client Hello,,,,,,,,,,,,,,,,,,,,,,,,,,,,,,,
286,46.403269,192.168.100.10,74.125.68.190,TLSv1.3,93,Application Data,,,,,,,,,,,,,,,,,,,,,,,,,,,,,,,
287,46.404663,36.92.238.204,192.168.100.10,TCP,54,443  >  50253 [ACK] Seq=1 Ack=518 Win=66816 Len=0,,,,,,,,,,,,,,,,,,,,,,,,,,,,,,,
288,46.406037,36.92.238.204,192.168.100.10,TCP,54,443  >  50254 [ACK] Seq=1 Ack=518 Win=66816 Len=0,,,,,,,,,,,,,,,,,,,,,,,,,,,,,,,
289,46.408039,36.92.238.204,192.168.100.10,TLSv1.3,1466,"Server Hello, Change Cipher Spec",,,,,,,,,,,,,,,,,,,,,,,,,,,,,,,
290,46.408043,36.92.238.204,192.168.100.10,TCP,1466,443  >  50253 [ACK] Seq=1413 Ack=518 Win=66816 Len=1412 [TCP segment of a reassembled PDU],,,,,,,,,,,,,,,,,,,,,,,,,,,,,,,
291,46.408046,36.92.238.204,192.168.100.10,TLSv1.3,535,Application Data,,,,,,,,,,,,,,,,,,,,,,,,,,,,,,,
292,46.408189,192.168.100.10,36.92.238.204,TCP,54,50253  >  443 [ACK] Seq=518 Ack=3306 Win=66304 Len=0,,,,,,,,,,,,,,,,,,,,,,,,,,,,,,,
293,46.422492,36.92.238.204,192.168.100.10,TLSv1.3,1466,"Server Hello, Change Cipher Spec",,,,,,,,,,,,,,,,,,,,,,,,,,,,,,,
294,46.4225,36.92.238.204,192.168.100.10,TCP,1466,443  >  50254 [ACK] Seq=1413 Ack=518 Win=66816 Len=1412 [TCP segment of a reassembled PDU],,,,,,,,,,,,,,,,,,,,,,,,,,,,,,,
295,46.422502,36.92.238.204,192.168.100.10,TLSv1.3,535,Application Data,,,,,,,,,,,,,,,,,,,,,,,,,,,,,,,
296,46.422657,192.168.100.10,36.92.238.204,TCP,54,50254  >  443 [ACK] Seq=518 Ack=3306 Win=66304 Len=0,,,,,,,,,,,,,,,,,,,,,,,,,,,,,,,
297,46.42645,74.125.68.190,192.168.100.10,TCP,56,443  >  50251 [ACK] Seq=46409 Ack=8640 Win=89344 Len=0,,,,,,,,,,,,,,,,,,,,,,,,,,,,,,,
298,46.441646,192.168.100.10,36.92.238.204,TLSv1.3,118,"Change Cipher Spec, Application Data",,,,,,,,,,,,,,,,,,,,,,,,,,,,,,,
299,46.442457,36.92.238.204,192.168.100.10,TCP,535,"[TCP Spurious Retransmission] 443  >  50254 [PSH, ACK] Seq=2825 Ack=518 Win=66816 Len=481[Reassembly error, protocol TCP: New fragment overlaps old data (retransmission?)]",,,,,,,,,,,,,,,,,,,,,,,,,,,,,,,
300,46.442557,192.168.100.10,36.92.238.204,TCP,66,[TCP Dup ACK 296#1] 50254  >  443 [ACK] Seq=518 Ack=3306 Win=66304 Len=0 SLE=2825 SRE=3306,,,,,,,,,,,,,,,,,,,,,,,,,,,,,,,
301,46.450458,36.92.238.204,192.168.100.10,TCP,56,443  >  50253 [ACK] Seq=3306 Ack=582 Win=66816 Len=0,,,,,,,,,,,,,,,,,,,,,,,,,,,,,,,
302,46.456393,192.168.100.10,36.92.238.204,TLSv1.3,118,"Change Cipher Spec, Application Data",,,,,,,,,,,,,,,,,,,,,,,,,,,,,,,
303,46.462052,192.168.100.10,36.92.238.204,TCP,1466,50253  >  443 [ACK] Seq=582 Ack=3306 Win=66304 Len=1412 [TCP segment of a reassembled PDU],,,,,,,,,,,,,,,,,,,,,,,,,,,,,,,
304,46.462083,192.168.100.10,36.92.238.204,TLSv1.3,177,Application Data,,,,,,,,,,,,,,,,,,,,,,,,,,,,,,,
305,46.462765,192.168.100.10,36.92.238.237,TCP,54,"50252  >  443 [FIN, ACK] Seq=2139 Ack=5815 Win=66304 Len=0",,,,,,,,,,,,,,,,,,,,,,,,,,,,,,,
306,46.463868,192.168.100.10,36.92.238.204,TCP,1466,50254  >  443 [ACK] Seq=582 Ack=3306 Win=66304 Len=1412 [TCP segment of a reassembled PDU],,,,,,,,,,,,,,,,,,,,,,,,,,,,,,,
307,46.463898,192.168.100.10,36.92.238.204,TLSv1.3,76,Application Data,,,,,,,,,,,,,,,,,,,,,,,,,,,,,,,
